{
  "$schema": "http://json-schema.org/draft-07/schema#",
  "title": "COSMIC Func Document",
  "description": "Functional-process design artifact migrated from cosmic-claude assets/schemas/func.json; metadata dropped (no manual-editing UX in hanzeep), desiredCfps added as the chain anchor copied from the upstream req artifact.",
  "type": "object",
  "additionalProperties": false,
  "required": ["docType", "language", "index", "desiredCfps", "funcId", "diagrams", "processes"],
  "properties": {
    "docType": { "const": "func" },
    "language": { "type": "string", "default": "zh-CN" },
    "index": { "type": "integer", "minimum": 1, "description": "1-based position of this function in the upstream plan functions array; must equal the upstream req artifact's index" },
    "desiredCfps": { "type": "integer", "minimum": 1, "description": "CFP budget copied from the upstream req artifact's desiredCfps; anchors the later tech-stage breakdown" },
    "funcId": { "type": "string", "pattern": "^[A-Z0-9]{1,8}(?:-[A-Z0-9]{1,8})+$" },
    "diagrams": {
      "type": "array",
      "description": "Full mermaid diagram source strings (sequence diagrams of the functional processes)",
      "minItems": 1,
      "items": { "type": "string", "minLength": 1 }
    },
    "processes": {
      "type": "array",
      "description": "Functional processes of this function; names must be unique within the document",
      "minItems": 1,
      "items": {
        "type": "object",
        "additionalProperties": false,
        "required": ["index", "name", "description", "originator", "receiver", "origination_event"],
        "properties": {
          "index": { "type": "integer", "minimum": 1, "description": "Auto-incremented 1-based process number" },
          "name": { "type": "string", "minLength": 1, "description": "Unique business-level process name (business object + action; design/technical words are rejected by rules)" },
          "description": { "type": "string", "minLength": 10, "description": "What this process does for the originating user" },
          "originator": { "type": "string", "minLength": 1, "description": "Who triggers this process (must differ from receiver)" },
          "receiver": { "type": "string", "minLength": 1, "description": "Who (system part) implements this process" },
          "origination_event": { "type": "string", "minLength": 10, "description": "The triggering event of this process" }
        }
      }
    }
  }
}
